<?xml version="1.0" encoding="UTF-8"?>

<!ELEMENT PR (CABEÇALHO,WORKTEAM,ABSTRACT,DELIVERABLES+) >
<!ELEMENT CABEÇALHO (KEYNAME,TITLE,SUBTITLE,BEGINDATE, ENDDATE, SUPERVISOR) >
<!ELEMENT KEYNAME EMPTY >
<!ELEMENT TITLE EMPTY >
<!ELEMENT SUBTITLE EMPTY >
<!ELEMENT BEGINDATE EMPTY >
<!ELEMENT ENDDATE EMPTY >
<!ELEMENT SUPERVISOR (#PCDATA) >
<!ELEMENT WORKTEAM (ELEMENTO)+ >
<!ELEMENT ELEMENTO EMPTY >
<!ELEMENT ABSTRACT (#PCDATA) >
<!ELEMENT DELIVERABLES (#PCDATA) >



<!ATTLIST KEYNAME
    KEYNAME CDATA #REQUIRED 
>
<!ATTLIST TITLE 
    TITLE CDATA #REQUIRED 
    >

<!ATTLIST TITLE 
   SUBTITLE CDATA #IMPLIED
    
>
    
<!ATTLIST BEGINDATE
   BEGINDATE CDATA #REQUIRED
    
>

<!ATTLIST ENDDATE
  ENDDATE CDATA #REQUIRED
    
    >
     
    
<!ATTLIST SUPERVISOR
  SUPERVISOR CDATA #REQUIRED
    
>
     
    
<!ATTLIST ELEMENTO 
    id CDATA #REQUIRED 
    NOME CDATA #REQUIRED 
    NUMERO CDATA #REQUIRED
    EMAIL CDATA #REQUIRED
>